{
  "$schema": "https://json-schema.org/draft/2020-12/schema",
  "$id": "https://cloakllm.dev/schemas/compliance_report/v1.1.json",
  "title": "CloakLLM Compliance Report",
  "description": "Structured regulatory-output schema produced by Shield.generate_compliance_report() (v0.8.0+). Designed to be auditor-consumable without CloakLLM-specific knowledge. Per-entry attestation block is shape-compatible with v0.8.1 ProvenanceReport (manifest-derived fields default to null until v0.8.1 KeyManifest ships).",
  "type": "object",
  "required": [
    "report_metadata",
    "period",
    "chain_integrity",
    "per_article",
    "verdict"
  ],
  "properties": {
    "report_metadata": {
      "type": "object",
      "required": ["generated_at", "cloakllm_version", "schema_version"],
      "properties": {
        "generated_at": {
          "type": "string",
          "format": "date-time",
          "description": "ISO 8601 UTC timestamp of when this report was produced."
        },
        "cloakllm_version": {
          "type": "string",
          "description": "CloakLLM version that produced this report."
        },
        "schema_version": {
          "enum": ["1.0", "1.1"],
          "description": "Compliance-report schema version. '1.0' (v0.8.0); '1.1' (v0.12.0) adds the additive `coverage` block. Bumped on schema additions/changes."
        },
        "audit_dir": {
          "type": "string",
          "description": "Audit log directory the report was generated from."
        }
      }
    },
    "period": {
      "type": "object",
      "required": ["from", "to"],
      "properties": {
        "from": {
          "type": ["string", "null"],
          "format": "date-time",
          "description": "Earliest timestamp in scope. Null if no entries in range."
        },
        "to": {
          "type": ["string", "null"],
          "format": "date-time",
          "description": "Latest timestamp in scope. Null if no entries in range."
        }
      }
    },
    "articles_in_scope": {
      "type": ["array", "null"],
      "items": {"type": "string"},
      "description": "List of EU AI Act / GDPR articles the report aggregates over. Null = all articles found in the chain."
    },
    "chain_integrity": {
      "type": "object",
      "required": ["verdict", "total_entries"],
      "properties": {
        "verdict": {
          "enum": ["verified", "broken"],
          "description": "Whether the SHA-256 hash chain links across all in-scope entries verify."
        },
        "total_entries": {
          "type": "integer",
          "minimum": 0
        },
        "anomalies": {
          "type": "array",
          "items": {"type": "string"},
          "description": "Human-readable descriptions of any chain breaks or schema violations."
        }
      }
    },
    "per_article": {
      "type": "object",
      "description": "Per-EU-AI-Act-article rollup. Keys are article identifiers (e.g. 'EU_AI_Act_Art_12', 'EU_AI_Act_Art_4a').",
      "additionalProperties": {
        "type": "object",
        "required": ["evidence_event_count"],
        "properties": {
          "evidence_event_count": {
            "type": "integer",
            "minimum": 0,
            "description": "Number of audit entries claiming this article in their article_ref."
          },
          "decision_count": {
            "type": "integer",
            "minimum": 0,
            "description": "Number of distinct decision_ids touching this article."
          },
          "categories_detected": {
            "type": "object",
            "additionalProperties": {"type": "integer"},
            "description": "PII categories aggregated across all in-scope events for this article."
          },
          "pii_in_log": {
            "type": "boolean",
            "description": "Always false in compliance mode. true => COMPLIANCE VIOLATION."
          },
          "bias_sessions": {
            "type": "integer",
            "minimum": 0,
            "description": "Article 4a only: count of bias_session_start events."
          },
          "wipe_confirmed_pct": {
            "type": "number",
            "minimum": 0,
            "maximum": 100,
            "description": "Article 4a only: percentage of bias_session_end events with wipe_confirmed=true."
          },
          "findings_recorded": {
            "type": "integer",
            "minimum": 0,
            "description": "Article 4a only: count of bias_finding events."
          },
          "generation_events": {
            "type": "integer",
            "minimum": 0,
            "description": "Article 50 only (v0.10.0): count of content_generation events."
          },
          "labeled_events": {
            "type": "integer",
            "minimum": 0,
            "description": "Article 50 only (v0.10.0): count of content_generation events with labeled=true."
          },
          "label_coverage_pct": {
            "type": "number",
            "minimum": 0,
            "maximum": 100,
            "description": "Article 50 only (v0.10.0): labeled_events / generation_events as a percentage (int when whole). <100 => NON_COMPLIANT (strict)."
          },
          "deepfake_events": {
            "type": "integer",
            "minimum": 0,
            "description": "Article 50 only (v0.10.0): count of content_generation events with deepfake=true (Art 50(4) disclosures)."
          },
          "modality_distribution": {
            "type": "object",
            "additionalProperties": {"type": "integer"},
            "description": "Article 50 only (v0.10.0): generation_events broken down by modality (text|image|audio|video)."
          }
        }
      }
    },
    "decisions": {
      "type": "object",
      "description": "Optional per-decision rollup keyed by decision_id. Only emitted when include_decisions=true (default false; large reports otherwise).",
      "additionalProperties": {
        "type": "object",
        "required": ["entry_count", "articles_touched"],
        "properties": {
          "entry_count": {"type": "integer", "minimum": 1},
          "articles_touched": {
            "type": "array",
            "items": {"type": "string"}
          },
          "categories": {
            "type": "object",
            "additionalProperties": {"type": "integer"}
          },
          "first_timestamp": {"type": "string", "format": "date-time"},
          "last_timestamp": {"type": "string", "format": "date-time"}
        }
      }
    },
    "attestation": {
      "type": "object",
      "description": "Aggregate attestation status across all in-scope entries. v0.8.0 reports signature checks only; v0.8.1+ adds KeyManifest-based provenance verification.",
      "required": ["entries_with_certificates", "schema_version"],
      "properties": {
        "schema_version": {
          "type": "string",
          "description": "Attestation block schema version. '1.0' = signature-only (v0.8.0); '1.1' = + KeyManifest (v0.8.1+)."
        },
        "entries_with_certificates": {
          "type": "integer",
          "minimum": 0,
          "description": "Count of in-period entries carrying a certificate_hash reference."
        },
        "signatures_valid": {
          "type": "integer",
          "minimum": 0,
          "description": "v0.10.3: a COUNT of entries carrying a certificate reference -- NOT a per-signature cryptographic verification. The audit log stores only a hash of each certificate, never the certificate itself, so per-entry Ed25519 signatures are not re-verifiable from the log alone. The verifiable attestation signal is KeyManifest provenance (attestation.provenance_summary.manifests_valid)."
        },
        "key_ids": {
          "type": "array",
          "items": {"type": "string"}
        },
        "provenance_summary": {
          "type": "object",
          "description": "v0.8.1-forward-compat slot. v0.8.0 emits null-filled placeholders. v0.8.1 KeyManifest fills these.",
          "properties": {
            "manifests_found": {"type": ["integer", "null"]},
            "manifests_valid": {"type": ["integer", "null"]},
            "within_validity_window_pct": {"type": ["number", "null"]},
            "root_signature_status_distribution": {
              "type": ["object", "null"],
              "additionalProperties": {"type": "integer"}
            },
            "timestamped_checkpoints": {
              "type": ["integer", "null"],
              "description": "v0.11.0: count of chain_checkpoint events in scope (null when none)."
            },
            "checkpoints_verified": {
              "type": ["integer", "null"],
              "description": "v0.11.0: count whose RFC 3161 token re-verified offline. < timestamped_checkpoints => NON_COMPLIANT (verify-don't-assert)."
            },
            "earliest_provable_time": {
              "type": ["string", "null"],
              "description": "v0.11.0: earliest valid TSA genTime (ISO 8601 UTC). Every entry before that checkpoint provably existed by then."
            },
            "checkpoint_tsa_distribution": {
              "type": ["object", "null"],
              "additionalProperties": {"type": "integer"},
              "description": "v0.11.0: checkpoint counts by TSA URL."
            }
          }
        }
      }
    },
    "coverage": {
      "type": "object",
      "description": "v0.12.0: the honest per-article coverage matrix. A static declaration (identical for every report of a given CloakLLM version) of the record-keeping/evidence/PII-minimization SLICE CloakLLM provides per article, and what remains the deployer's responsibility. NOT a claim of full conformity. Byte-identical across the Python and JS SDKs.",
      "required": ["schema_version", "disclaimer", "articles", "out_of_scope"],
      "properties": {
        "schema_version": {
          "const": "1.0",
          "description": "Coverage sub-schema version."
        },
        "disclaimer": {
          "type": "string",
          "description": "Plain-language statement that CloakLLM covers a slice, not full conformity, and that coverage is gated on the deployer verifying detection quality."
        },
        "articles": {
          "type": "array",
          "description": "One entry per EU AI Act article CloakLLM touches.",
          "items": {
            "type": "object",
            "required": ["article", "title", "status", "cloakllm_provides", "deployer_responsibility"],
            "properties": {
              "article": {"type": "string", "description": "Article identifier, e.g. EU_AI_Act_Art_12."},
              "title": {"type": "string"},
              "status": {
                "enum": ["partial", "record_keeping_only"],
                "description": "'partial' = CloakLLM provides part of the obligation; 'record_keeping_only' = CloakLLM records that the deployer met it but does not perform the obligation itself (e.g. Art 50 labeling)."
              },
              "cloakllm_provides": {"type": "string"},
              "deployer_responsibility": {"type": "string"}
            }
          }
        },
        "out_of_scope": {
          "type": "array",
          "items": {"type": "string"},
          "description": "Articles/obligations CloakLLM makes no claim about."
        }
      }
    },
    "verdict": {
      "enum": ["COMPLIANT", "NON_COMPLIANT"],
      "description": "Overall report verdict. COMPLIANT iff chain_integrity.verdict='verified' (the hash chain is actually re-verified as of v0.10.3) AND no in-period entry has pii_in_log=true (a global invariant, independent of any article filter) AND every KeyManifest passed provenance verification (attestation.provenance_summary.manifests_valid == manifests_found, when any are present)."
    },
    "verdict_reasons": {
      "type": "array",
      "items": {"type": "string"},
      "description": "Empty when COMPLIANT. Lists each reason when NON_COMPLIANT."
    }
  }
}
